{"foundation_sha":"ca29b99135316dd62cf58045cc82c1302b35e066","schema_version":1,"suite_id":"foundation.initial","suite_version":4,"task_count":15,"tasks":[{"fixture_root":"fixtures/foundation.task-001","grader_root":"graders/foundation.task-001","manifest_path":"tasks/foundation.task-001.json","manifest_sha256":"2fa6a9bba273fd7df081ff73602f89c1f5b841c6f69263e557874f88de412f05","task_id":"foundation.task-001","task_version":1},{"fixture_root":"fixtures/foundation.task-002","grader_root":"graders/foundation.task-002","manifest_path":"tasks/foundation.task-002.json","manifest_sha256":"3f691fcc9c264e0769bd96f5f956171d244110fe91e9c800adad7848ad38af29","task_id":"foundation.task-002","task_version":1},{"fixture_root":"fixtures/foundation.task-003","grader_root":"graders/foundation.task-003","manifest_path":"tasks/foundation.task-003.json","manifest_sha256":"162b784a5f54e3ca9b69396b663758a82f63434ad7ec562f7bbca291839b5cd4","task_id":"foundation.task-003","task_version":1},{"fixture_root":"fixtures/foundation.task-004","grader_root":"graders/foundation.task-004","manifest_path":"tasks/foundation.task-004.json","manifest_sha256":"dd5b1014050574ec80eb0eb35ec96fb42e084663b1ca3d55cf003b3bf151ff47","task_id":"foundation.task-004","task_version":1},{"fixture_root":"fixtures/foundation.task-005","grader_root":"graders/foundation.task-005","manifest_path":"tasks/foundation.task-005.json","manifest_sha256":"2003d57bccf62e3f7e1ba9aea61aa8a30d42d5e7105129a063313e022f2418ab","task_id":"foundation.task-005","task_version":1},{"fixture_root":"fixtures/foundation.task-006","grader_root":"graders/foundation.task-006","manifest_path":"tasks/foundation.task-006.json","manifest_sha256":"a6c9e017d8b247158ac2092628406be3c7bbf9f1b75b0b77013adf025efd2449","task_id":"foundation.task-006","task_version":1},{"fixture_root":"fixtures/foundation.task-007","grader_root":"graders/foundation.task-007","manifest_path":"tasks/foundation.task-007.json","manifest_sha256":"ed1b5282b51eda71ae308863a7f86e788af3d8dd08d627b0c32ce2655ace73f4","task_id":"foundation.task-007","task_version":1},{"fixture_root":"fixtures/foundation.task-008","grader_root":"graders/foundation.task-008","manifest_path":"tasks/foundation.task-008.json","manifest_sha256":"82f775cbef0d1865beafc057fe15606e2283d207e5a4719826ccbd7381e9487d","task_id":"foundation.task-008","task_version":1},{"fixture_root":"fixtures/foundation.task-009","grader_root":"graders/foundation.task-009","manifest_path":"tasks/foundation.task-009.json","manifest_sha256":"2b35418f72a970ab6e9b49ba2913f5d7ea065b362a9931026d6af59a797d9f67","task_id":"foundation.task-009","task_version":1},{"fixture_root":"fixtures/foundation.task-010","grader_root":"graders/foundation.task-010","manifest_path":"tasks/foundation.task-010.json","manifest_sha256":"23e914ab54d536ece037419cc50dbf1d279606cd18347f891a6b45fd0fc760d2","task_id":"foundation.task-010","task_version":1},{"fixture_root":"fixtures/foundation.task-011","grader_root":"graders/foundation.task-011","manifest_path":"tasks/foundation.task-011.json","manifest_sha256":"a2b280da40c24f20f8d7d757f8a171490daf8bb98cf54a73a2c7cc0db4508c00","task_id":"foundation.task-011","task_version":1},{"fixture_root":"fixtures/foundation.task-012","grader_root":"graders/foundation.task-012","manifest_path":"tasks/foundation.task-012.json","manifest_sha256":"c9518804876b5d83afdc46887d484f3814414b096ac90b7309e3dff4bbad0f5c","task_id":"foundation.task-012","task_version":1},{"fixture_root":"fixtures/foundation.task-013","grader_root":"graders/foundation.task-013","manifest_path":"tasks/foundation.task-013.json","manifest_sha256":"58d9b60a818a02d00ac086a59810a7af3c0b2a541338b3fe132e90ecf44cae92","task_id":"foundation.task-013","task_version":1},{"fixture_root":"fixtures/foundation.task-014","grader_root":"graders/foundation.task-014","manifest_path":"tasks/foundation.task-014.json","manifest_sha256":"88b025ff6f27cacbdd4445d344689d04a8e77e7c8a9fa05a829c6b317fb8600f","task_id":"foundation.task-014","task_version":1},{"fixture_root":"fixtures/foundation.task-015","grader_root":"graders/foundation.task-015","manifest_path":"tasks/foundation.task-015.json","manifest_sha256":"f6901ab398f3fcf518125d0d3931dd1fd80f3f2498cd2a58336e1a9b3ab5955f","task_id":"foundation.task-015","task_version":1}]}